[
  {
    "dealId": "0192f0c8-3c4e-7a2b-8c3d-4e5f6a7b8c9d",
    "recoveryId": "0192f0c8-3c4e-7a2b-8c3d-4e5f6a7b8ca0",
    "cancelSig": "cdcdcdcdcdcdcdcdcdcdcdcdcdcdcdcdcdcdcdcdcdcdcdcdcdcdcdcdcdcdcdcdcdcdcdcdcdcdcdcdcdcdcdcdcdcdcdcdcdcdcdcdcdcdcdcdcdcdcdcdcdcdcdcd",
    "oldDevicePub": "ED26D54D80051A116166CF76FEA87330D546680B875827B87AF1B1D58B9EB464E1"
  }
]
